{
  "schema_version": "voice-agent.observation.v1",
  "record_sequence": 1,
  "wall_time": "2026-08-15T00:00:00.000+00:00",
  "monotonic_ms": 12.5,
  "session_id": "session-fixture",
  "turn_id": "turn-fixture",
  "stream_epoch": 1,
  "stage": "control",
  "event": "published",
  "fields": {
    "event_type": "turn.completed",
    "terminal": true,
    "total_turn_ms": 450.5
  }
}
